processed_tweet,username
 you cant fix someon who broke so long ago,suicidalconcept
 accident cut they dont hurt more than word,suicidalconcept
 the numb consum me,suicidalconcept
 everyon hate me,suicidalconcept
 everyth is against me,suicidalconcept
 life is not on my side,suicidalconcept
 i laugh it off as if the word didnt hurt but it did pain,suicidalconcept
 suicid thought keep come,suicidalconcept
 look into my eye and tell me that im fine but im not,suicidalconcept
 it get tire,suicidalconcept
 i just want to avoid everyon,suicidalconcept
 they just want to see you fall,suicidalconcept
 no motiv no noth,suicidalconcept
 fake smile that the onli thing im realli good at,suicidalconcept
 no one is with me,suicidalconcept
 stay strong they said but they dont even care,suicidalconcept
 help other but not myself,suicidalconcept
 it okay i wouldnt choos me either,suicidalconcept
 i need someon to stay by my side but everyon seem to leav,suicidalconcept
 no one understand me,suicidalconcept
 regret regret,suicidalconcept
 not do someth of my interest and i cant chang it,suicidalconcept
 my life is mess up right now,suicidalconcept
 i feel like ill never be happi again,suicidalconcept
 whi is thi happen,suicidalconcept
 i just cant stand the pain,suicidalconcept
 push everyon away,suicidalconcept
 lifeless,suicidalconcept
 i feel so dead,suicidalconcept
 nobodi would even notic if i wa dead what make you think they will when im aliv,suicidalconcept
 i feel so left out even though there are so mani peopl around me,suicidalconcept
 regret my decis,suicidalconcept
 my vision is a blur right now,suicidalconcept
 my friend dont know im suicid,suicidalconcept
 shatter edit,suicidalconcept
 ive lost so much,suicidalconcept
 i feel so lone till it hurt,suicidalconcept
 i feel so tire all the time,suicidalconcept
 your fat get fatter oh my god youv gain weight and all i can do i laugh and smile although it hurt so much insid,suicidalconcept
 i wonder if you still care with me act all happi,suicidalconcept
 compar myself at everi chanc i get,suicidalconcept
 social anxieti,suicidalconcept
 i keep tell myself i dont need them but the truth is they dont need me,suicidalconcept
 i dont exist in anyon eye unless they need me,suicidalconcept
 there no need to piti me,suicidalconcept
 drown or rather drown,suicidalconcept
 id rather be dead,suicidalconcept
 no one care we all depend on our own,suicidalconcept
 theyr just ask for the sake of ask they dont realli care at all,suicidalconcept
 some say im a happygolucki person ill never have depress but im just good at act happi and put on a fake smile,suicidalconcept
 dear me no one want you,suicidalconcept
 depress happen anytim anywher,suicidalconcept
 im not surpris when peopl leav me they alway do alway,suicidalconcept
 im honestli so close to break,suicidalconcept
 you should be with someon better,suicidalconcept
 i mean whi would you look at me im ugli,suicidalconcept
 where is anyon when i need them,suicidalconcept
 you dont have to lie to me i know im not good enough,suicidalconcept
 im not who you want,suicidalconcept
 i dont need you to tell me what i am becaus i know that im noth,suicidalconcept
 when i have to smile and act like it alright when my famili say im get fatter,suicidalconcept
 sometim i feel like it me against the world,suicidalconcept
 worthless damag ugli,suicidalconcept
 i can be happi one moment and sad the next,suicidalconcept
 onc again overthink,suicidalconcept
 the cycl of not be abl to sleep everi night,suicidalconcept
 will you miss me when im gone doubt it,suicidalconcept
 they say they understand my pain but honestli they just dont care,suicidalconcept
 i feel worthless all the time,suicidalconcept
 insomnia,suicidalconcept
 alon still alway,suicidalconcept
 no mood for anyth,suicidalconcept
 where is everyon when i need them oh let me guess they are busi,suicidalconcept
 they onli come to me when they need me,suicidalconcept
 i hope it rain,suicidalconcept
 pretti girl get everyth huh i guess that whi i have noth,suicidalconcept
 the onli thing that is there for me,suicidalconcept
 dont miss me when im gone,suicidalconcept
 i wonder if anyon still care,suicidalconcept
 im never posit you just never saw through me,suicidalconcept
 alway overthink,suicidalconcept
 endless night,suicidalconcept
 i dont need to be constantli remind that im better off dead,suicidalconcept
 yep call me fat it so funni,suicidalconcept
 no one truli understand me,suicidalconcept
 lie lie lie,suicidalconcept
 fail,suicidalconcept
 suicid,suicidalconcept
 im almost at my limit,suicidalconcept
 i might have to kill myself to kill the demon insid,suicidalconcept
 constantli overthink,suicidalconcept
 i wish i wa prettier for you,suicidalconcept
 youll regret be with me,suicidalconcept
 dont love me im ugli pathet and useless,suicidalconcept
 im not good enough,suicidalconcept
 im ugli,suicidalconcept
 the empti feel in my chest,suicidalconcept
 overthink at everi hour at everi minut and everi second,suicidalconcept
 im worth noth,suicidalconcept
 i just cant stop compar myself to other theyr so much better than me,suicidalconcept
 no one should be with a piec of shit like me,suicidalconcept
 you deserv better,suicidalconcept
 i should kill myself,suicidalconcept
 i feel that i cant do anyth right,suicidalconcept
 i hate myself so much,suicidalconcept
 havent slept forday and i feel drain,suicidalconcept
 she obvious better than me i wouldnt be shock if you want her,suicidalconcept
 i wonder if im good enough for you obvious not,suicidalconcept
 i keep compar myself to other and the more i do the lower my selfesteem get,suicidalconcept
 the most depress thought that enter your mind are the one at night,suicidalconcept
 even with so mani peopl around i still feel lone,suicidalconcept
 my thought wander the further they got the more depress i becom,suicidalconcept
 anxieti is when there is more and more peopl it get harder to breath,suicidalconcept
 i wonder how doe it feel to be perfect i can never achiev that,suicidalconcept
 im drown,suicidalconcept
 no one is there to help me,suicidalconcept
 i feel so ugli and sick of myself,suicidalconcept
 no one want me,suicidalconcept
 i want to break down so badli,suicidalconcept
 no one can ever understand they think i have it easi,suicidalconcept
 my reflect disgust me,suicidalconcept
 but ill still have to continu to smile,suicidalconcept
 as alway,suicidalconcept
 everyth to me is a blur,suicidalconcept
 i cant concentr on anyth right now,suicidalconcept
 even with so mani peopl around me i still feel so lone,suicidalconcept
 overthink everytim when im alon,suicidalconcept
 no one is ever there for me,suicidalconcept
 stress out and look like shit,suicidalconcept
 am current overthink,suicidalconcept
 thought pleas go away ive alreadi had enough today,suicidalconcept
 all i want is to be happi but it never happen,suicidalconcept
 it okay just leav me alon i dont want to talk to anyon right now,suicidalconcept
 i liter sick and no one bother to even ask me,suicidalconcept
 im just so so tire,suicidalconcept
 oh pleas im alreadi dead insid,suicidalconcept
 im just so annoy with everyon nowaday,suicidalconcept
 you may know me but you do not understand me,suicidalconcept
 selfesteem drop,suicidalconcept
 im alway compar myself to other,suicidalconcept
 i wish i wa dead,suicidalconcept
 ive tri my hardest yet i still fail worthless,suicidalconcept
 everyon get sick and tire of me,suicidalconcept
 im in the state of mind where everyon is against me,suicidalconcept
 im tire and stress out but no one can see that,suicidalconcept
 my exist caus so much pain to other,suicidalconcept
 i need to go far far away and get away from thi place,suicidalconcept
 i mean whi would you choos me im noth and they are so much better,suicidalconcept
 it not becaus im angri im just frustrat with how worthless i am,suicidalconcept
 im so useless,suicidalconcept
 assign due soon and all i can do is overthink and procrastin,suicidalconcept
 i wonder what wors wake up everyday think that im gonna live or die in my sleep,suicidalconcept
 onc again,suicidalconcept
 wait and wait but noth good come,suicidalconcept
 onc again alon,suicidalconcept
 it becaus of me it my fault i shouldnt be here i shouldnt exist,suicidalconcept
 whi cant i be better at someth,suicidalconcept
 when it come to me i alway fail,suicidalconcept
 im just a disappoint to everyon,suicidalconcept
 one of those day where i just want to avoid everyon and not do anyth,suicidalconcept
 go to school is like step through the gate of hell,suicidalconcept
 it the first thing i notic everytim,suicidalconcept
 the cycl of my everyday life,suicidalconcept
 push everyon away but i just need someon to show that they care enough to stay with me,suicidalconcept
 i need loud music to cover my thought,suicidalconcept
 do you know what it feel like to be compar to someon who is so much better than you it hurt and yet you have to smile and pretend,suicidalconcept
 i want to run away and never come back ever,suicidalconcept
 the feel of be trap and suffoc,suicidalconcept
 even when im with my friend i cant control my thought anymor it just becom suicid,suicidalconcept
 no one want me here anyway,suicidalconcept
 the constant feel of commit suicid,suicidalconcept
 you wont ever understand me,suicidalconcept
 im just tire do you realli think so,suicidalconcept
 fall over and over again,suicidalconcept
 walk on the road without look both way well not anymor,suicidalconcept
 look up i use to see star but now it is to hold back my tear,suicidalconcept
 becaus if i stay i destroy thing,suicidalconcept
 im so close to break,suicidalconcept
 i wish,suicidalconcept
 knock down over and over again and im so tire,suicidalconcept
 i can cri and walk out like noth ever happen,suicidalconcept
 dure time like thi,suicidalconcept
 who care,suicidalconcept
 it okay im just a wast of space and time,suicidalconcept
 it endless and i cant help it,suicidalconcept
 sleepless night endless thought,suicidalconcept
 just a littl kitti for halloween ,suicidalconcept
 i just want to run away from everyth,suicidalconcept
 overthink kill im alreadi dead,suicidalconcept
 midnight thought,suicidalconcept
 sad yet with a smile on my face,suicidalconcept
 will you miss me when im gone,suicidalconcept
 i wonder when is the one day that ill disappear,suicidalconcept
 i just wish someon wa there for me,suicidalconcept
 music is my onli companion when no one is here for me,suicidalconcept
 lone,suicidalconcept
 selfdestruct,suicidalconcept
 when someon ask you are you okay and your tri to hold back your tear,suicidalconcept
 im just tire,suicidalconcept
 to disappear and never come back,suicidalconcept
 blast music ignor the world,suicidalconcept
 one day i wont be around to caus you ani pain,suicidalconcept
 girl who are pretti be like i look like a potato look at me what am i then,suicidalconcept
 i wonder if anyon still love me,suicidalconcept
 peopl leav eventu,suicidalconcept
 am think about suicid,suicidalconcept
 pm overthink,suicidalconcept
 i stop look both way while cross the road i mean who care right,suicidalconcept
 it sad how i wa onc so happi,suicidalconcept
 school where fake a smile is my specialti,suicidalconcept
 i look up to the sky to stop the tear from fall,suicidalconcept
 you still think it a joke,suicidalconcept
 and youll never be abl to bring me back from the dead,suicidalconcept
 i can feel it even with my eye close,suicidalconcept
 mood swing not,suicidalconcept
 if i dont hurt myself im hurt everyon around me,suicidalconcept
 do you realli think that im okay,suicidalconcept
 i just wish i wa better,suicidalconcept
 who would care im noth,suicidalconcept
 no text no call no noth i honestli think you dont care about me anymor,suicidalconcept
 suicid dead numb pain,suicidalconcept
 am i just an object that youll onli use when you need,suicidalconcept
 overthink,suicidalconcept
 would you care if i bleed if i fall if im gone,suicidalconcept
 is my exist even valuabl to you,suicidalconcept
 they act like they care but they dont,suicidalconcept
 the onli way out is to kill myself to kill the demon insid me,suicidalconcept
 a fake smile for everyon everyday,suicidalconcept
 one day youll miss me,suicidalconcept
 no one can see it through my fake smile not even you,suicidalconcept
 a fake smile is all i need to fool you,suicidalconcept
 cant you see how much pain im in,suicidalconcept
 i feel that you dont even care i mean whi would you im noth,suicidalconcept
 no one want me,suicidalconcept
 i might just do someth that i have alway want to,suicidalconcept
 from a few to a lot,suicidalconcept
 get from bad to wors,suicidalconcept
 you dont realli care do you,suicidalconcept
 im the worst,suicidalconcept
 happi on the outsid die on the insid,suicidalconcept
 what i gotta do just to be happi,suicidalconcept
 i need to feel pain to feel aliv,suicidalconcept
 they hate me everyon hate me,suicidalconcept
 it back depress back,suicidalconcept
 i feel like shit right now,suicidalconcept
 so use to the nightmar,suicidalconcept
 i wont be around to caus you anymor pain hk,suicidalconcept
 dont worri no one will miss me,suicidalconcept
 i wish i could die right now,suicidalconcept
 im use to it,suicidalconcept
 ive hurt so mani peopl wouldnt it be better if i wa dead,suicidalconcept
 i need the courag to kill myself,suicidalconcept
 i hope you found someon better prettier skinner unlik me,suicidalconcept
 other girl are so perfect while im me cant even be compar to them,suicidalconcept
 sometim i feel pretti but then i notic my flaw and it die off,suicidalconcept
 the onli time when i feel happi about lose is die,suicidalconcept
 i feel so worthless,suicidalconcept
 it will alway come back and you know it,suicidalconcept
 she doe art crave a pictur on her wrist with a blade,suicidalconcept
 sometim i feel like everyon hate me,suicidalconcept
 there a differ between want and need,suicidalconcept
 sometim it better to let go than to hold on but i cant seem to do so,suicidalconcept
 would anyon notic if i wa die,suicidalconcept
 sometim it easier said then done,suicidalconcept
 promis are meant to be broken,suicidalconcept
 i dreamt that i die never felt so reliev in my life,suicidalconcept
 mayb i wa meant to be alon,suicidalconcept
 stop lie to yourself you just love me out of piti,suicidalconcept
 whi would you love me im not good enough,suicidalconcept
 it happen so much that im use to it,suicidalconcept
 well it true that they dont care unless your pretti or die,suicidalconcept
 pretti girl alway get the attent huh,suicidalconcept
 someth that make me forget about the pain,suicidalconcept
 it becam like a drug when i made that first cut addict,suicidalconcept
 i tri be happi but soon after boom someth bad happen,suicidalconcept
 what happen to your wrist oh i fell down my cat scratch me,suicidalconcept
 everyon think im fine but honestli im not,suicidalconcept
 if im not hurt myself im hurt other,suicidalconcept
