id,tweet,hs_label
4340,تتوقعون هرب بعباءه امراءه وسلم مدنه ومخازن اسلحته للحوثي اكثر الف جندي ال احمر,1
4341,ناحيه الخيوط,0
4342,قبلها ايفانكا ترامب والهنديهبريا ام غمزه واخرها رءا الصبان فترههاشتاق غزل ببنت اوجنسيهمعينه ابرر وقاحهالبنات بالمقطع اذا ذهب الحياءحل البلاء شء عادي السوشيل ميديا فلاتستغربوا اللي صاير الله يسترعلينافوق الارض الارض ويوم العرض,0
4343,والله ياخوي يرضيني عشان اي وحده تفكر تسوي الشي لين ندافع بسنا خلاص,0
4344,يارب افناني تسكر اكاونتها لانها تفشل واللي مستانسين ان شاءالله انتوا وخواتكم تصيرون,0
4345,انا صايره تلوع كبدي بسرعه هالمقاطع ماعاد صرت اتحمل,0
4346,تقههر مريضه,0
4347,الحزبي يقول تدعمون الدول العربيه يحكمها العسكر العسكري اشرف,3
4348,اتفوووووووووه الخونه,0
4349,معليش توقعت ذوقكم انزل لهدرجه,0
4350,قصيته سويت شي انا مو مسءوووله حشا وراعيته مالها شويه احساس سمحتوا,0
4351,هههههههههههههههههههه بطاقته جبتوها لامستحيل الله المستعان,0
4352,بسمع الالبوم وبتحلل,0
4353,اعوذ بالله الحسد,0
4354,اي اي خلج جذي,0
4355,رحت الغيني قاموسك,0
4356,الاشياء القديمه حلوه الا صورنا واحنا صغار تجيب مغص بالعين,0
4357,نيتي صافيه,0
4358,مءلمه الدمعه تسقط صامت تسقط شده القهر والالم والاحتياج,0
4359,ههههههه اشوه اني تغديت اقرا تعليقج والا جان مابتغدا,0
4360,بنات الرياض طاحوا,1
4361,تشوفي الوضع,0
4362,الورد الفن الجميل دار زغوان,0
4363,اما يكون قانون شديد العقوبه متسبب القذاره والمنظر الغير حضاري او بلاها نريد اعياد وطنيه نريد مناسبه ذكرا تحرير الكويت والسبب سلوك الهمج ابناء وطني يملكون ذره حب وطنهم,1
4364,وحرمتها تعيش حبها وشبابها استبعدش انها عجبهاش علاقه الياغهاز اللحظه اللي قبلها شافت سنان يقبل نيل عادي خلي بالك وخلاص همها الفلوس عبده فلوس وتتمسخر ياسمين امهات المسلسل عايزين اباده,0
4365,عمر طويل ماترسله يعود يا كءابه,0
4366,يا نوفا قلبي مايتحمل حب اخوي وحب زوجي ماينفع اختاري واحد كتير واضح انه مايبي يتصور ماقدرت اخد كابتشر حلوه اخليها صوره بروفايل اعتقد اللي صورتهم سيدا والله اني ماحبيتها الصبح لازقه ليه خيير يعني,0
4367,النساء كالفواكه امراه طعم ولون مميز المشكله الرجال يحبوا سلطه فواكهه,0
4368,شي تسويه حق تشوف التفاهات,0
4369,تفكرين انه اخذ حيوانه بيصير حيوان,0
4370,يعني شفت ناس لزقات زي هييك  لاااااااااا,0
4371,صححح,0
4372,تستهبل انت مسوي ماتعرف الخاص تقفله,0
4373,مديح محله مبالغه المجاملات محبه مصطنعه اصبحت اغلب العلاقات,0
4374,مجبورين نكتب الفراگ چان احباب عدنه وفارگونه عيشونه بعشگهم اجمل احساس شوفت وجهم عودونه مااريد احچي جرحي ملچوم واريد يطيب جرحي بشوفت عيونه,0
4375,يع يعع نخلص ايفانكا وروا الصبان ونجي ميوت للكليجا والقصيم,5
4376,وانا روحت فين,0
4377,الاسوا المراهقات الي بالهاشتاق الا الخرفان الي حاطين صورهم ويتميلحون يعني اني احلا,1
4378,الصلاه مديرتي صلاه الظهر بجامع الراجحي والدفن بمقبره صديان,0
4379,غلط واكبر غلط البكاء امام الرجل,0
4380,تضحك يا زفت,0
4381,طررررب,0
4382,وش قلت,0
4383,بنات الشعبه وسواس قهري المواد يسالون تفاصيل التفاصيل خصوصا وحده تحب توسوس اصفقها,0
4384,والله والله عيب وقله حياء فعلا الرجال جاي يترزق الله وانتو كرهتو عيشته طول شهرتو واضح تصرفاته انه قرفان المبزره والهمج اللي الله يفكنا الاشكال المتخلفه,1
4385,انا اسمي,0
4386,عصابه عاوزه الدبح واسمها حكوووومه وزيره الهجره المصريين بالخارج عايزين يصوتوا بدماءهم ويبحثون مشرط لا وانتي الصادقه ده احنا بنبحث ساطور نطير رقبه امثالك جرا ايه حاجه صوتوا عليكي وسكتوا يا شيخه,1
4387,جد والله نفسيات بالسناب مراقبات,0
4388,السماع طرف واحد,0
4389,الحلقه,0
4390,يبنتا انتا لسه مفركشه سنه حب لحقتا ترتبطا تانا جرحي بيلم بسرعه يا ستي انتا مالك,0
4391,بسم الله الصخنه,0
4392,الله الوكيل السبب سحب الهءيه ومنعهم الامور كنا وصرنا الله يستر مسلم ومسلمه,0
4393,فكر منطق والمشكله يستعان كمحلل وناقد,0
4394,ويرزقك,0
4395,انا ودي اعرف سواقي وش مستعجل ظهريه والله ياهو رجنننني رج,0
4396,الا تعالي وش دخل يوم تبغين تدعين,0
4397,دايم اسويها احس غجغجغج,0
4398,انا الان حاله صدمه مدري انا طالعه اختبار سيرجري اختبار جغرافيا انا متاكده الاختبار شي الا سيرجري اول مره اطلع اختبار ومابي اتاكد الاجوبه ولاحتا تكلمت احد ابد ويوم شفت قروب متجمعين يتناقشون انحشت ياساتر وش بيكون الاوسكي,0
4399,,0
4400,يا ناءحه خلاص انكشفت دناءتك الناس العاقله تعد ترد  يعزز كلاب الحمارين  نشتاق لرءيتك لنكرمك,1
4401,فضحتني ياعم انت شوفت الكراكيش اخدو فكره غلط ازاي,0
4402,علاقه للزمن بالنضج نكبر التجارب وللاسف بعضهامءلمه حتي اعز الناس قلبك,0
4403,العيال مسوين مءدبين نسيتوا انكم تخقون عع الشغاله يالله انك تشفيهم,1
4404,المشكله يفشل,0
4405,ياخنزير,0
4406,خوفي انصدم باجاشي او سنباي اللي احبهممم,0
4407,وتسع وتسعون طعنه,0
4408,خلصانه بعمود خرسانه,0
4409,منو يضمها,0
4410,كنت مكذبها جمله متاع لاكن بنقلا  اتطيح شعب معيله,0
4411,يارب,0
4412,الموضوع بيهمك عرفتا لقيت وللا انتا قول الداير تقولو عديل تلف وتدور,0
4413,لجينااااا جبب,0
4414,طيب الشي يوم جت بنت ترامب حليمه احد الفاشينستات الاقل البنات ماطلعن قصايد وشيلات وخطبنه بالملايين,0
4415,الحين يجون يتبكبكون,0
4416,شخيصه شوف كمان احد اسباب كرهي لعفاش التعليم يعني ماكاتب حضرتك دكتور الاملاء شيء يستفزني والله,0
4417,كتفكير كده اننا كبني ادمين نعمل ان فولو لحد بنراقبهم اكتر ناس عملنا بلوك بندخل صفحه تانا نشوفهم  ليه مانكلمش مايمكن نموت قريب,0
4418,واحده رايحه تشتري فراخ ماشيه الراجل قالتله شكرا  قالها ايه دواجن,0
4419,احنا شاردين الفضاءيات العربيه القماميه قصه محتوا يحترم العقل والمنطق وهمجيه طول مايبغالها تفكير علشان لايغثوني خدمه حذف حذفتها,5
4420,تحقيق الاحلام يكون بالاتكال بشر تحقيق الاحلام يكون بالتوكل الله والتمسك جوري,0
4421,فضحتونا ياخفيفات وحده شوهت سمعتنا كبنات وجعلتم العالم يظنونا جميعا اشباهككم,1
4422,ابغا ارتبط تعبت الانفصال,0
4423,تراكم هلكتوناا يومين الانستقرام يفتح والسبب الخدمه الزفته مالكم خلاص معذرين منهاا نقدر نلغيهاا,0
4424,عمك ياسر,0
4425,الدعم الجبار وانا ابو كلب حقها تخق,0
4426,مشكله والله تروحين دكتورتك صديقتك وتخليها شاهده وتقلب صديقتك تهديد خلاص يعني شاهده يبيلها,0
4427,مءلم تستيقظ السابعه صباحا نوم جميل لتري وجوه تسد النفس  تتاكد فعلا العيش مر,0
4428,مدري نفتك ورعنه اصاحب المنتاجات والله مسلسل تركي المقاطع عيييييييييييييييب عييييييييييييييييييب تادبو,1
4429,اعوذبالله الواحد ماعاد يرتاح فتره الرجال طايرين بنت ترامب فشلونا واللحين البنات طايرين بايع الكليجا صدق انكم شعب مسعور ومو شايف خير الله يخارجني مجتمعكم المتخلف هاذا خير كرهت الحياه,5
4430,السلام انا اول سنه تقديم النقل كتبت اول رغبه الرياض وثاني رغبه الخرج رغبتي الحقيقيه احصل فرصه تاريخ المباشره الي عام ٢٩لاني سمعت ان الرغبه ٢الا ٢٠لا تءثر سنه التقديم مارايك,0
4431,شكله جرب عاش انه يطلع بيته ويطق مشوار كيلو وينجا بقدره الله حوادث محققه يوميا سواء الجو مطر او صحو,0
4432,ناويه تنطردي,0
4433,هاشم يبيك روحي دفعه مرجي والهواء شرجي,0
4434,ويشغل الولاعه ويطفيها,0
4435,روبن متطفل,0
4436,ماله داعي وكليجا,0
4437,تخيلو عامر والطقه,0
4438,زي الخرا,0
4439,ماهزت شعره رءوسكم وتميم والوزير نامق يلفون العالم يبكون يقولو يتم غزو قطر النباح تركناه قناه الخنزيره لسان تميم القذر محنا كفو انتها الحال,1
4440,ياشين الشي راعيه ولد ويغار,0
4441,والله الفشله وقله الحياء الا الان ترند اعقلن يبنات جعلتس للذهاب انتي واياها,0
4442,الحين الشباب قايمين البنات ليش خاقين المز طيب نسيتو بنت ترامب صرتو خرفان خرفان حطو شيلات,1
4443,اقول لقيتك وجه,0
4444,عباس رضي الله قال قال رسول الله صلا الله وسلم دين خلقا,0
4445,المفروض ولد مرتبط ينزل صوره حبيبته واكثر وحده تكرر نسويلها جلد وتفقيع وجه,0
4446,روح اساله,0
4447,تجنن نايمه خير هاذي حالاتها حلوه,0
4448,انا ضد اللي سووه  اهون تتجمعون وحده تبيع تتجمعون حليمه ترسلون صوركم,0
4449,خطر,0
4450,مخك عباره مجموعه بلوعات,0
4451,الف الف مرحبا مي نتوما ممنوع,0
4452,ترامب دفع الف دولار لنجمه افلام اباحيه تردد انها اقامت علاقات جنسيه ترامب توليه منصبه بيان نشرته وساءل اعلام امريكيه استخدم امواله الشخصيه لتسهيل الدفع السري فلوس الخليج وسلمانكو البقره الحلوب,1
4453,انهم جنود ورجال الامارات,0
4454,جماله عادي اقل عادي البنات مو شايفين خير,0
4455,طفا الجوال وتوي اطلع المحاضره,0
4456,ثواني يا شباب ونازلكم,0
4457,كملوها ووزعوا هالكتب هالهاشتاق ذكرني بالمحاضرات اللي يخلونا نسمعها ايام المدرسه الشموس,0
4458,ياكذبتس الحين انتي صقعتيني براسك وانتي تعورتي,0
4459,ولاد عبد الناصر مليارديرات ولاد السادات مليارديرات ولاد مبارك مليارديرات ولاد الوسخه واقفين يهتفوا للعسكر,5
4460,الله اكبر اش هالتاق,0
4461,زباله,0
4462,الحيوانات وشبها ماغلطت السعودي ياما للعنه,1
4463,هتشل يا توتو خلاص انا بنهااااار,0
4464,روح شريفه ليه تروح غزوكم وسط ديرتكم,1
4465,يا بت اطير رقبتك,0
4466,وينهم امريكا النفط  السعوديه النفط كانت بتعاني مجاعه مافتكرت بلاش عبوديه,1
4467,القصيم كمان غبار,0
4468,الله ياخذ الحق,0
4469,السلاح,0
4470,اي مصريه ماتلعب جلدتني مالت,0
4471,استفررااغغ,0
4472,يعني اللي بياخذك خبيث زيك هههه,0
4473,ههههههه لانها ماغدرت شريفه تقتل اخواننا السنه برضو شريفه الله لايبلانا,2
4474,زين الاقل يسولفون سفرات وفلوس مو باعراض الناس شفت فلانه الي بيتهم المنطقه الفلانيه كنت اعرفها,0
4475,وانا,0
4476,يا ثقل دم بنات المتوسط الثانوي,1
4477,بوه طرق مابه رجعه يعني اذا مشينا مانقدر نرجع نقدر نوقف مابوه طريق نكمل متعب لين نوصل نهايه ونتعلم الطريق الزفت عد نمشي,0
4478,اول خطوه بكسر اخوك واروضه قوتي واشقق خرقه شقق بحد ماخنثه واديثهه اخليك تنيكين وتناكين اخوك ريتويت,0
4479,الصخب عموما,0
4480,طيب مو الحين,0
4481,ذهبت تشتري فستان فاعجبها حذاء فاشترت حقيبه النساء ويجيك واحد يقول ابي وحده تفهمني خل تفهم بالاول,1
4482,والمساعدين عادل نوار عثمان ابوبكر مالي,0
4483,الظاهر اني رح اتاخر المحاضره اللي اصلا صاحي بدري عشانها حياه زي الفل شاء الله,0
4484,اقول تركي بعر وربعك والذباب الالكتروني دليم الفلس جعلك تفدا قطر وثرا ارجيل اميرها تميم المجد وشعبه يا الضفعه المتوت نعمه الله باذن الله تعالا كاس العالم فقطر,1
4485,وووووووعععععع الله يقرفهم,0
4486,اكره اقوم اخوي الصغير للمدرسه تكون الغرفه بارده ومتمسك بالبطانيه انا اسحب يسحب يع اطفش اقوم العيال مره نومهم ثقيل وربي ارحمه ودي اقول غيييب مايصير,0
4487,تسمحيلي وشو,0
4488,يا فندق,0
4489,سنه نظيفه المنافقين والصحبه باذن الله,0
4490,مشهور,0
4491,يا امه ضحكت من جهلها الامم,1
4492,احقرها,0
4493,انتو منو دازكم اليوم,0
4494,هوا كدا يبقا انا الوحيد تقريبا الا تويتر الا لسه منزلتش مصطفا قمر جيلكو ياشويه مترحمونا بقا,0
4495,حالتك صعبه تقلع,0
4496,السكاشن,0
4497,متكنش حضرتك عامل اكونت باسم انا الشبح وتدخل تقولي مش عارفني اخص,0
4498,الووو انت احسن واحد لانك ماين سومبرا,0
4499,اسال الله بحوله وقوته يحفظ دينه يكفيه شر فتنه النساء الله يرزقه بالزوجه الصالحه اللي تفسح قلوب اللي صورنه فسح هول الصدمه تجيهن سكته سءال للبنات اللي يصورونه فتح غطايه الصرف صحي وخرجكن اش الرخص والقرف اللي,1
4500,حقيقي مببقاش عايزه اسالك كتير اعمل ايه حاجات كتير ببقا عايزه اعرفها,0
4501,اللي بيحب النبي يضرب,0
4502,انت قادر البعاد قربت ليه يا حبيبي,0
4503,هطلع برنامج,0
4504,كذب,0
4505,طيب واحنا اللي مالنا مكان احنا اللي ارسلنا قلوبنا اشكال والوان اللي دا دروا,0
4506,ريتويت احححح عجبك ريتويت,0
4507,خلاص انكتمو,0
4508,تقديرات وحشه وكانت حاجه خرا,0
4509,يحوول قبر واليوم جنازه,0
4510,يعني هيبقي عريس ناكل جاتوه دا حتي ظلم,0
4511,اختصرها,0
4512,شعب غريب يدخن ب الحمام ويبول ف الشارع,1
4513,والنعم فكرت ابيع كليجا خايف الاسبانيات يخقون اجمل الله يعين اللي يشتهر بنات ايامه تعيسه,1
4514,الله يحشرك سوا فالجنه او النار والنار اقرب والله اعلم,0
4515,خبر عاجل الرياض غبار شديد اليوم الاثنين,0
4516,طب قومي البسي علشان بكدا مش هنلحق حتي باص,0
4517,يااااوك ياصوتها ليتني ماشفت المقطع,0
4518,تعلم الموفد الوهابي وصل لبنان قادم للنباح ضد حزب الله اسبوعين تم تركيز البيت الاسود لبنان بزياره معاون وزير الخارجيه ساترفيلد استمرت تعلم سفيرا منحاز ضد حزب الله تعلم علاقه سريه سوريه,1
4519,حشا قصاب ماشيه وسكينها معاها,0
4520,حداااك الوقت حولهاا وازهل الموضوع وابشر بالسعد مسااءياات,0
4521,النوم عجزت انام,0
4522,لحول شوهتو صوره باءعه الكبريت الا كنت راسمها وانا صغير ببايع الكليجا,0
4523,كششششششششش,0
4524,شكلك شفت التشكيله يا خطاب الخطه الغريبه البدا بيها,0
4525,ارزقه الله بنعيميات بلدي,0
4526,يابقعا صووعيه الصبح صبحتك يابعيد اصطلخوو جلدك,0
4527,الجو مش بيمطر يوم الحد بالليل ليه بجد يعنا بيعرف منين ان دا يوم السكاشن بتاعا وبروح بالبالطو مغسول ومكوا وزا الفل عشان يتوسخ اوصل ويبقا زفت ماهو مش اسبوع هشترا بالطو,0
4528,عم متقولش لحد,0
4529,تغير المسار,0
4530,جونغجين متحمل ييسونغ انا منننننننن زماااان كفخته قال هيونغ قال,0
4531,منهي مادخلت استغفر الله صور مقززه,0
4532,الصوره دا بتقتلني,0
4533,يعني اقول هالشي يمووووووت لازم يجيني هالسءال وش قصدك حلو شين يعني تتوقعون شي شين باخذ وبقولك انه يموت,0
4534,بخليهم يفغصونك,0
4535,قدمت الاكل وقالت قل بسم الله ياكلوا الجن قال طبخك والله مايقربه جني,0
4536,بالعكس نوع انواع المداعبه,0
4537,اكبر مقامك,0
4538,هيه,0
4539,قمه بالسخافه الحمدلله والشكر الله يقطع الخفه اللي شفتو خيير قطع اثقلي انتي وياها,0
4540,وش دخل العوارض,0
4541,سالفتك ميته وجهك,0
4542,اصلا مش مهم بيعرف قديش سعر ربطه الخبز ببلده المهم وبيعرف ياخد سيلفي ويقول خليكن,0
4543,مبطولش اخر حبلين غسيل افضل اتشعبط زي المتخلفين البلكونه,0
4544,منجد الف,0
4545,الاعمال بالنيات يا اخا نصفا نفوسنا لان التوبه اسعارها فشخت المواطن الغلبان اللا اقصا امله يزور بيت الله,0
4546,الديد الساار,0
4547,رقدوا الليل مشوها بوس,0
4548,الشبك الشبك الشبك ياحمير الحمارين لاتنهق يالكذبه ازعجت القروووود,0
4549,اشعر بالاشمءزاز والغثيان اتذكر سليطين الطرطور يريدونه يكون حاكما ل قطر نستبدل ادن,1
4550,اكيد صعبه وبعدين حنا فاشلين بالتيفو,0
4551,ياربي الصباح تطلع بوجهي ناس تقول شيخه حشي فيني,0
4552,جمهور اصلن نصهم يشجعون الوحده ياااااا طحلب,3
4553,قلبنا يابنت خلينا حلوين يعني انتم وش يجملكم الميك اب,1
4554,الخير,0
4555,نكت العرب قديما لبن وتمر تمر ولبن ويضحك الجميع ويعم السرور الحمد لله انهم ماتوا,0
4556,ياربي شعور انك تكره احد مرض اشيل هالشخص حياتي,0
4557,ماتدري وش الفرق,0
4558,صادقه يرجعونك الاعضاء واربع عيون,0
4559,سبت البت الي بتحبها وجيت ترتبط بيا اه الي قلتلي شوفلك كلبه,1
4560,باقي البرزينتشن,0
4561,الله يلعنهم لعنه وقف,0
4562,زينه اعلانات زين,0
4563,,0
4564,الله يفضحكم بنات عز الله ماربيتم,1
4565,بعرف وحده جاينهم تعارف مشت كتبت الفيس انها اتخطبت وباركلو يومين الموضوع فرتق,0
4566,حايمه كبدي مكتبي اللي نفسيات مره ومودهم دايم ابوكلب,0
4567,تطلعنا ١ بنت الكلب,0
4568,واغسلوا سنانكم واشربوا اللبن ماتناموا ياماسريين,0
4569,الهوشششش,0
4570,بتوقيت كوريا عمر هوب خاصتنا جايهوب سنه عالميا سنه كوريا نتمنا عيد ميلاد سعيد,0
4571,تفشلت وانا مالي دخل,0
4572,وها الميديا ايه للتويتات علشان تحطها الفيس لبوستات الفيس علشان تحطها تويتر,0
4573,ايام مين ياعمي,0
4574,عمي انا اقول ماكو شي وكلام فاضي اكو شي جان وخلص الاخبار الاكيده والصح بالسناب لاتصدق ويعطيك العافيه ولاتاملون الناس وتعلقونهم واخر شي,0
4575,يصفعني امتحان واطيح ويوم توني بوقف يصفعني امتحان ثاني,0
4576,الواحد وين يحتفل وتانيب ضمير الدراسه وراه,0
4577,ابثرتونا مافتح برنامج الا بوجهي,0
4578,الناس منشني مريضه وتعبانه ومرهقه وهادها المرض وبمنشنات تردح ردح مافيها الا العافيه,0
4579,الانثا امتياز مرتبه الشرف عيل بقره هااااا,0
4580,الله يعافيك,0
4581,قطار الكتيبه الكبير يستطع ايجاد محمد ستجده انت الصحراء,0
4582,احترم فكره ان العتب يجي محبه والله عتاب يغثك ويمسح حسناتك,0
4583,الاخ ثامر يحاول اظهار جماله الداخلي,0
4584,عموما هاليمنيه تمثل نفسسها وماتمثل بناتنا وشوفاتنا ابداااا تمثل شاكلتها,0
4585,اسكب الخمر سلطنه الاسلام الوسطي العادل المتعايش اذا المملكه سوت اي شء طلعت غلطانه صحيح انك كلب المهم اذا خلصت نبح المملكه حاول تنصح بلادك وتستنكر وجود الخمر بترخيص الدوله لانه يفترض انك ماتعيب غلط الناس وانتم مسويين شء اعظم فهمت ياكلب,0
4586,اسوء غثيان الصبح وتقوم وتتغصب الفطور تبغاه,0
4587,مو صاحي وينه طالع,0
4588,هههههههههههههههه يوم الدين,0
4589,هههههههههههههههههههههههههههههههههههههه,0
4590,الجو هواء فا تراب صعب اوا,0
4591,والله اسلوبك الرخيص والواطي,0
4592,الشرهه ماهيب عليتس اللي يبيتس تشبعين,0
4593,وصحيت الم فضييييع,0
4594,اظهر وبان الامان,0
4595,حكايه عشق  ارخص ماعندك شرفك يهتك اقرب مز ههههههههههههههههههههه حياتك ماتسوا ريال,0
4596,مايلبسه الا ناقص,0
4597,فيلم دقاءق معدوده استغرق العمل شهرا فاز اضخم الجواءز والفيلم محادثه,0
4598,ههههههههههههههه انزين انزين بعديها هالمره والله باجر الساعه بكتب صباحكم انا واجوفك تقول انا اول,0
4599,يبقا تبا,0
4600,اكره صح وخطا,0
