id,tweet,hs_label
1,ردينا التطنز,0
2,وصارت فطاير البقالات غذاء صحي,0
3,روحي لبريده تلقين اشباه كثير ماحد زيكم مشفوح يخقخق ويطالعهم انحطاط ويصورهم الله يفشلكم,0
4,مش باين حاجه خالص مش عارف بقا,0
5,يقولك المسلمين خاله اسمها امل عمه امل او اخت امل او زوجه امل او بنت امل او حماه امل واللي ماعنده امل بالعاءله يراجع لانه وضعه مو طبيعي قروب امل اسعد القروبات اذا وحده اسمها امل ارسلوها,0
6,حمدلله ماحطها فمي اساسا,0
7,هههه,0
8,اللي مايضحك هالمقطع يبلكني هههههههه مطططههببللللل يمثلني ههههههه,0
9,خلاص الله يزعجكم خلللاص,0
10,هيلق جحلط مافي,0
11,تعبت ارد كونت تراا متخلفين ورجعيين اكتبها كوول كيفي ياناس حلوا سماي اااف,0
12,صادق يسب الصحابه ويدعي تحريف القران ويتهم عاءشه بالزنا وش نسميه مسلم مطور مثلا الا بيض الله وجهه كلامه صحيح وماقال الا الحق ياالبقره,2
13,بقوه,0
14,تذكروا جيدا اكرم الله القارءين وتذكروا جيدا داءما جاهزون  لتلبيه وعد ابليس ابليس يقول محا,0
15,ذبانه اصيدها والله اربطها واركض يمها واصرخ,0
16,وين الحش اذا فهمته واشكاله ان زمن جلسه البيت انتها وولا حش وبعدين وش نظام سواليف البزران اكبر ياخي,0
17,انا مره اقولكم مو عيب اللي تسوونه  الكذب الناس حرااااااااام,0
18,شمشوم المجهر عمي شوف انا خاصمك تصعب بدك محامي انت تطلب,0
19,وووووووووووووووو رومان رينز,0
20,ان شاء الله يرفع قضيه وتنجلدين اهلك,0
21,يلاا مشينا,0
22,ترند بتويتر لعنبو ابليسكم خلو المسلم بحاله شهرتو,0
23,تحصل علا غد افضل مادمت تفكر بالامس,0
24,بهذذذذدي صدقت قسم محد يفرح الااا اللي يحبك او رحم ربي,0
25,دكتور فارس بتفرقكن تخلو التيار وحدو يجيب الحاصل,0
26,تعوسي عطاني فولو دخلت صفحته اشوفه كاتب انو ساقطات اللي خقو بايع الكليجا وطايح قذف حسابه الحقير اباحيات استشرافه صنفه قوي عطيته بلوك,1
27,١٦٠ الف كيلو اجيبها ٣ سنين بتضحكو مين قال الضمان ٨ سنين قال,0
28,اختفا مروان تلودي طلعوا جولي شيك القرشي,0
29,اليوم الجوا اكثر راءع,0
30,يوجد اشد هالفضيحه بشار اللهم ارحم شهداء الوطن الابرار دعواتكم الله القوي الجبار الم,0
31,تخيل نحتفل بالتعادل فريق جزمه ابو نوران اكبر تاريخهم,3
32,حاط صوره حسن نصر الله ويقول اهل الكويت الاصليين الطم,0
33,الرءيس السيسا لرءيس الاركان يامحمد عايزك تشيل الارهابيين وش الارض اح,0
34,مبروووك ٣ خليتوها ٤ ترا وضاح خسران انديه لندن,0
35,انا اسافر بعيد التحرير,0
36,اكره شي الحياه تطلع بيتكم متسبح ومتعطر ومتزقرت وتدخل بوفيه العامل قاعد يقلي فلافل خلاص الحين وش يخلص اليوم ابي ارمي الثوب احسني صره فلافله,0
37,نه,0
38,كسرتيني غيدا تحبين وراي  ليه تخونيني,0
39,جاتني كتمه  ٣ مواد ليه,0
40,الشمال,0
41,قلتي يا الضرح واي اعتداء عضيدي اعتداء الرد بيكون شديد,0
42,لحول انت جالس شي اكتبه,0
43,ليش هالحقد احد النص,0
44,شكله مافهم معنها,0
45,تتغير طريقه اكل الكليجا البنت تبوسها تاكلها الولد يدبجها ياكلها,0
46,ليه انت حبيبك كتير,0
47,الله ناس تجري راها الشهره ناس تجري را الشهره العالميه تعني اكسو,0
48,ماش,0
49,جد يعني باجر دوام,0
50,للاسف انهم يكذبون يتنفسون,0
51,افا يا الطرش يا التركستاني طلع لسان وتتجرا تتكلم المنتخب السعودي,1
52,اقوا شي يسد النفس تجلس واحد ياكل تمر ويمصمص اصابعه ويرجع يقلب التمر ينقي يقولك شفيك تهبش هبشك كيبل كه,0
53,مايدرسون جغرافيا,0
54,ايمتا يخلص هالشهر والله انو يوم,0
55,ميووووت,0
56,اقسم بالله اني اشوف انك تاكل تبن احسن ياطبل ياطار للبنات والفساد انطم ياذكر بعيد البعد الرجوله ياحيف اذا عاجبك اللي ليه ماوديت اهلك وخليتهم يعطون رايهم ويصورون ولد الناس اللي ابتلش اللي تصفق الخلا مير الخلا ياتسلب,1
57,قله ادب وادوختونا صدق,0
58,بيجيبون امراض الدنيا وانا توني بعمر الزهور,0
59,الله يفضحكم فضحتونا العربان,0
60,بنات وش الله اتقوا الله وارتقوا  ايش كميه الانحطاط بالتاق ما يلفظ من قول الا لديه رقيب عتيد,1
61,بسم الله,0
62,طيب تدف,0
63,حقش حق وحق الناس مرق,0
64,رخم,0
65,الي يبيع الكليجا لابس كمام ريحه اديوسهن وريحه اباطهن المعفنه الله لايلومك,5
66,ممحون,0
67,الاشخاص بسبب انجازاتهم يستحقون كتاب شكر يحتوي صوره شخصيه بفلتر,0
68,يا بنت,0
69,رساله الرءيس عبد الفتاح السيسي لرءيس الاركان مقر القياده القناه يامحمد عاوزك تشيل الارهابيين وش الارض,0
70,اخاف نصاب بالسمنه,0
71,وياريت نواسا اصحاب الجيوب الانفيه وحساسيه الانف والصدر  يتعذبون,0
72,التفاح ابل مفيش اكترمنه,0
73,حد لاقي ياابني,0
74,الهاجوس يابو فارس ماريحنا متاملين خير,0
75,بغسلهم عقب ماغسل شراعكم انتما معا بارك الله,0
76,شكلي انا الوحيده اللي اكره الشيلات,0
77,مدري وشفيهم النسوان انهبلووو هبل اقسم بالله تقليد مرض تدري وش تسوي ومرض اخر التخريب انا خربانه خرب الشله,1
78,جد,0
79,بنظفونها وبيرجع الغبار,0
80,ليه الافتري دا,0
81,الحقيقه والله شي مخجل اللي شفته كميه جراه مقززه البنات بشكل لايوصف وين الحياء والحشمه الظاهر ماعاد حياء حشمه الجيل رحم ربي,1
82,والله ياخوي محد يرضا,0
83,ككوولوووزززققققققق,0
84,يارجال انت خايف مصلحه الاتحاد مافتحت الموضوع الا مابعد بطوله الملك للاسف كنت احترمك كاعلامي اتحادي,0
85,انتي هتقوليلي,0
86,ماابي احلف واثق تماما ان وجودي مسبب لاغلبكم سعاده كلامي صح اكيد,0
87,والله انها قليله ذوق تنظر لرجل زوجها وعيب اساس تنظر لشخص زوجها اساس شكلها متخرفنه بايع اكبر قذره واكبر قله ادب اهجدو مذابكم الكعبه اخواني انهم اجمل وجهه مليون مرا عادي مااشوف جمال الا تشوفونه زعجتونا ترا هه,0
88,تعليقي ياتبارك الرحمن اله الله,0
89,البحرين,0
90,٣ ايام وانا احلم احلام,0
91,واللي جالسين فنادق الرياض ثلاث سنوات ويستنزفون التحالف وش تسميهم الله ماتستحقون,0
92,مصطلحات ال غالي متوتر لدرجه انه لايستطيع الجلوس نمله بنطلونه الابط تستخدم للتعبير النتانه والقذاره متورط للغايه قوله المصريين حبل المشنقه لاف رقبته,0
93,عيش ياااابطال وهكون الابطال اقول ايه دولت اقول ايه,0
94,المشاوير,0
95,فهمت غلط قلت صديقي,0
96,المستدعشين فاهمين النصيحه غلط,0
97,انتم تسمعوني تستهبلون مادريت حق الكلجا الي طفشتونا اهتميت كلامي وصفك بان نبوه للنساء لانهن وفيات تقدر تنتقد تصرف البنات التقول الدين يا مقطعين الوفاء فهمتوا  تعتبت وانا اشرح,1
98,قلتله مسامحه اني كلمه وقالها لساني بقلبي شي ثاني تعبانه وخسرني,0
99,قصه عشق احلا موقع مسلسلات,0
100,يا شين الخليجي اذا مهند,0
101,وش قله الادب,0
102,تعبت الوزن الزاءد تريد تنحف راسلني خاص وابعت وزنك وطولك الحل,0
103,وش يا مطحون,0
104,لسه بتاوح,0
105,الحمدلله والشكر افتكينا خرفان ايفانكا جونا خرفان بايع الكليجا,0
106,وتت قاع يقذف,0
107,مظنش متزوج بقاله يتزوج الرابعه,0
108,كنا مغشوشيين باخلاقهم ومذهبهم الدموي,3
109,بعيد سوء كلامه ترفعه المراه يحسن سلوكياته وتصرفاته مشيته كنه بنت وتصرفاته ورقصه,0
110,فضحتينا,0
111,اتعس شي المباراه وانت خسران مغبون تشوفه ينزل الملعب يسلم اللاعبين يتبوسم الوضع طبيعي,0
112,يع خلاص تومتش,0
113,والله يعينش نفسش,0
114,فعلا اععععع,0
115,هههههههههههههههه خلاص ماراح انام بدري,0
116,اههاا يعني يالحريم خقو تراي ياكثرهم,0
117,ان حق انا حق بتجي فيكك قذر,0
118,اسوء الرجال يتحدث محبوبتنه للاخرين ليجعل فريسه سهله,0
119,بقا,0
120,الواضح انه,0
121,الهندي قاعد يثبت للمعزب الخروف صديقه يذبحه,1
122,كبيه الله لايسامحه كلب يعاملنا انحن دجاج,0
123,الله ينقص ويزيد,0
124,احسن,0
125,صوت اللي تصور,0
126,طيب ليش حاطه التسليم الدفع المفروض ادفع بعدين استلم طريقتها مضحكه غبيه,0
127,انا مش عارفه اي عدم الحياء الي الناس بقت ده,0
128,عنز,0
129,هههههههههههههههههههههههههههههههههههههههههههه خططي وارسمي لاتخلينه يضيع,0
130,اي,0
131,يالله خير الواحد يرسل شي جميل تخيل تبدا يومك بالاهلي اي شوم بالله الاهلي,0
132,غالبيتكم عملاء الاحتلال جاثم رءوسكم,3
133,يسوي انا المز,0
134,نتعوذ الشيطان,0
135,اداع حسابك اقروا الرقم زين وقولوا امين بلاش حسد,0
136,اللي يشوف كلام هيلاري يحط بفم واحد ينكر وجود مءامرات ضد دولتنا والدول المجاوره ان تنتهي مءامره تكون دسته مءامرات جاهزه ضدنا طبعا اذنابهم تعتبرهم الاستثمار الحقيقي المدا البعيد الاعتراف الحقيقي بخلق داعش ومساعده الاخونج اللعنه جميعا,3
137,يا الله بختنق,0
138,خلاص اشغلتنا,0
139,سحبتوا جاء شي الايميل,0
140,يستااااار,0
141,ايفانكا ندري طقطقه ولاهي داريه هوا دارهم اللي يستحون سعوووووودي احرجوه واحرجوا اهله منجد ان تستح فافعل ماتشاء تربيه,0
142,والله مافيه مسعورين زي العيال,0
143,انتي ماقلتي شي بهالمناسبه,0
144,تاريخهم اسود يومهم الله يجعلهم واردا,0
145,زعلت زياده ماشفت وجهك كثير,0
146,مش وكده روحت الجامعه اكتشفت ان انا محضر جدول التلات مش الاتنين وعليا النهارده رسم,0
147,الحمدالله اني مو قطريه,1
148,طيب لاتصيحح يا اخوي ترا الدعوه كره قدم,0
149,وينه دا وينه جبوولي هوا اتفاهم معاه,0
150,يااااو فديت الخشه,0
151,فعلا كلشي بسببها يالي قهرني بتتكلم الكاميرا طول الربورتاج بارش كانو النجمه لامعه بارش الحارس الشخصي ليش الانحياز الصحافه ليش نسيو نجوميه بارش شعبيتو تركيا راحت الهيبه بتاع بارش صحافه تافهه صراحه,0
152,ياارب متاخدكيش الجلاله تانا وتقاوحينا اقولك هتكسلا كده,0
153,انتي بتفضحي البت عشان مش هتشوفها,0
154,لقطه جولاق حمستني قهرتني الصور,0
155,شعب الله المتحشر,0
156,الخير,0
157,انا قاعده بالبنك ناطره دوري سمعت موظفه عم تلقي محاضره طبيه لزبون سعل عده مرات قدامها بلشت تحكيلو فواءد الدوش,0
158,عشت فا البلد سنيين طوال وشفت استفتاءات وانتخابات عجيبه وغريبه عمره شفت فا سخافه اللا بيحصل الان,0
159,واللي تقصر عباته شبرين وتطلع طويله,0
160,اوكي مو عطر رجالي يناسب بنت,0
161,نصاب لااحاد يشتري تفو يالجزمه,0
162,اوفففففر عااد الحريم مادري شفاحه قله ادددب  عيب والله,1
163,شوفي بوعصا شن كاتب,0
164,تبقا معديه ماتسلمش عليا فعنياااا ينفع كدا يرضيكوا لاااء لااءء لااء,0
165,صارت بالثانوي جيت متاخر ٧ وقالت طالعه واحد  المشكله اهلي موصليني المدرسه وانا كنت غبيه ساكته ماعرف اتكلم,0
166,الجايه ختي بدل تخلينا نفتش بتاعك,0
167,ياريت,0
168,دعايات زعل وخضرا التلفزيون الاردني بتمغص,0
169,برافو يا مريسيل اقسم بالله انك اذكا اعلامي يقولكم الدوري بالريوس يا جمهور الاهلي اتركو تكتيكه للدوري ليتحول للاهلي الاسيويه اضاعها الهلال بسبب المريسيل جعلهم يعيشون ترشيحه وسقطو متاهات ومصيده المريسيل كالعاده واكلهم اوراوا ساده,3
170,تقلقن حنوكك انت وياهم همداكم قسم اني مشغول واشغلتوني,0
171,وش هالشفاحه والانحطاط بالتاق اغلب البنات  العيال تغزلو ببنت ترامب اعذاركم السخيفه  نظل بنات عجبك امدحي اللي مو لازم العالم تعرفك انك مشفوحه الله يبلانا,1
172,الحظه السعاده ياويلكم ياعذال تهزاوا مكاني واصل حدي ههه كلام عادي وربي الزمن مردوا غدار الشيطنه,0
173,ابعتيلا طيب,0
174,ياخي اللي يقولون انها كلمات محسن تركي اشفييه ترا صدق بيقولون ماهي جريمه يعني وبعدين هاني يبي شو منجد السالفه البارح وباقي للحين,0
175,امه البيت كانت تناديه سلوم يعصب يقول تقولين سلوم اسمي سليمان والحين خطيبته تناديه لومي يرد اعصريني,0
176,ايه الفراغ ده,0
177,واللا استجدعنا معاهم طلعوا مش صافيين جواهم,0
178,ماتجي بااااااااااااااااااااااااااااااااااااااع,0
179,قاعد تشد وجهك وتلوي فمك وخشمك عشان تبان الغمازه مدري الحفره الي بوجهك ونظام خالف تعرف عشان رتويت يحمار الغلط غلط الانثا والذكر مو عشان العيال سوو غلط خلاص البنات يسون وثاني شي الرجال ازعجوه برزقه وبالنهايه تعصر وجهك الا بكره ماراح تكون زين وتتميلح,1
180,عطيتم الحريه وللاسف تصرف لاءق ابدا,0
181,يقرف عمرك ياباسل,0
182,امشي انت ماسورهه,0
183,الجوهره يتسع ل٦٠ الف ٨٤ الف كذبه تواردت,0
184,روح روح اندمجت حساب تنزل يومياتها والاماكن,0
185,سحقا ولامثالك,0
186,اللقطه الختاميه الي امس,0
187,تكون بتتفرج الماتش وامك تقولك هات قناه زي الوان,0
188,الله يجعلني كليجا,0
189,المشكله دلوقتي يا جماعه ان بكره مش الجمعه الجمعه وخد التقيله بقي بكره كمان مش الجمعه,0
190,الفلووس ال بتبقا البنطلون ويتغسل بيهم,0
191,احسه اقول فهمتو,0
192,معلش يا زاتو بنكون مضايقين مش بنحب نتكلم رخمه اما بتبقي زعلانه,0
193,احلام اليسا ينعن ام الشخصيات الخرا متصنعات اكووووووووه ياربي,0
194,النت اهم حاجه بالدنيا,0
195,رجعوووووها لسعرها الاولي افضل,-1
196,انتحار جماعي,0
197,الحيوان الي بالصوره شنو عيوني اجعتني,0
198,موطن الورد غمازه حبيبي,0
199,صارت بامسي قتل تورغوت السلطان الخرا يبي يعدم ارطغرل,0
200,انت نوري ملاك نهال راين شهد ويسو ومنال بنت شهد طولهم وسط البقيه سنافر الفراشه مشكوك طولها,0
201,برب بروح اشحنه,0
202,قالت مريم ياليتني مت تعلم بطنها نبي بعض الكربات تحمل طياتها كرامات تياسوا,0
203,مشافيييح يفشلوو,0
204,الله قصدي امدحج مالت,0
205,رخمه ياملافظ السعد قول الفنانه احلام,0
206,عيييب بنات يشوفون,0
207,مساعد جزار بينفع,0
208,وباقي تقولوا حنا خفيفين والله الخفيفين اسبوع خاقين جعلكم العما,1
209,الجنسين خرفان ويفشلوننن  تفو هالاشكال,1
210,باك,0
211,اعطل ايشي تقعد حد بكنكن,0
212,يمكن كذابه تتعاطفون مقطع كذذب انا شفت سنابها غسلت يدي,0
213,جماعه الوزير ترا الكويت مو وزير,0
214,ازيها دلوقت ماتت اسبوع بتموت قداما مش قادر اعملها حاجه ورحمه اما النهارده مش هقف ساكت,0
215,مدمني القهوه صحتييييين الطيبه,0
216,الهندي قاعد يثبت للمعزب الخروف صديقه يذبحه الله يستر ب,0
217,اخيييي يغار يقلب هالدنيا نار يعاتب بصرار ابوسه طااااف شي بووووح,0
218,شيء مخزي,0
219,عزيزتي الحياه تمگيجي بليز قرف يقرفك مشنعكك,0
220,انا مش هرد هناا لينا جامعه تلمناااا,0
221,شكل الشباب والبنات يبررون الفاسدات الي البايع والله مقرف ويجيب سالفه بنت ترامب اساس انه راضين ماكنه طلع هاشتاق يمنعون اللحوج الدشير بالتغزل الفاحش زي الفاحشات الي الرجال,1
222,اكتر ناس بتغلط وحياتها غلط اكتر ناس لسانهم الكلمه دي,0
223,والله صادقه ياروني الانفتاح بنظرهم والله يستر اللي جاي,0
224,الطريقه التانيه دي اضمن كامل مدفوع,0
225,ابغير البضاعه دامها للرجال اببيع قنابل الزوجات فعاله وتنهي الضحيه بلحظه تعطيه فرصه يتنفس,0
226,عزاه,0
227,شي ضدي اليوم,0
228,اشغلتو المسلم الله يشغل العدو ماقدر يبيع بسبب البهاءم الي كرامه والا حشمه,0
229,الله يضيق صدوركم كرهتونا شيء,0
230,ماهوووو,0
231,يا جماعه لا شوفوا حل فا ده علاء الاء علشان الانسان بيحرج كتير بسبب الحوار ده  اكتبوا اسمكم بالعربا يا جماعه,0
232,خاص للقوارير المعرض الجاي السم الهاري مجانا لاحيا ولامستحا يارب سلم سلم,0
233,وينك انتي الصبح ندورك,0
234,وصلنا ناس متخلفه لسا تقول طروش بحر,0
235,يارب اربي كلب,0
236,حابه تويتر بشكككل,0
237,استغفرك ياربي الحال اللي وصولو بناتنا قليلات الحياء والادب  ايش الجراه الوقاحه باقي شوي ويرمون حضنه شدو بناتكم ياعالم والمفروض يدبر احد يبيع بداله وكفايه تميلح,1
238,انصحك مره بخصوص دريكنقارد تعتبر السلسله الاساسيه ونير تعتبر الجانبيه روابط بسيطه باللعبتين,0
239,الجو يخليك غصب تروقيين,0
240,الي مو عاجبه يناظر,0
241,للحقاره عنوان اسمه ليليان داود ردي وافحامها قامت بعمل بلوك ينعل ابو القرف,0
242,خيانه,0
243,مازعلت ياتحريات كلب,0
244,صاحين مخرج الفلس مو حاط,0
245,هانت اليوم اخر يوم دوام,0
246,اليوم براسي احتمال شغالتك المستشفا سمح الله جتني,0
247,محد احسن احد متجمعين تقل غنم متجمعه علف,0
248,انت اكتب حكمه البارح مب حكمه اليوم خصم يومين راتبك,0
249,يا ظلي يا روحيي,0
250,مادري ليه ماانقرض اللي انقرضو,0
251,اي والله صدقتي تخسي,0
252,طولي ١٥٢ وزني ٥٠ واللي يقول سنفوره,0
253,مزالي فايقه بكير ولسا لنضع الاي لاييييينر,0
254,وانا اللي مستغربه هالتجمهر بركن القصيم قسم المعمول والكليجا  استغربت شفاحه الاكل اثاريه شفاحه شي ثاني,0
255,تم,0
256,انا الزلمه يحلفون باسمي,0
257,بعصب,0
258,يووووووه تاني مارينا مش عاوزه مش عاوزه,0
259,بنظرك زين,0
260,تنطم يقال شوفوني يابنات انا احامي اسلوب غبي قسم,1
261,ميسي حقق مجد لبلده وانا مكنتش اتفرجت حاجه دا اولا ثانيا علشان رايي ضدك يبقا بتفرج كوره شراب معلش ابقي غطيها المره الجايه وانت نايم كويس علشان متبردش وكسم ميسي لكسمك,3
262,وزير النقل اليمني يفضح دور الامارات الاضرار باليمن واهله  طريق منع مشاريع التنميه ودعم الجماعات والميليشيات الارهابيه  فضحنا الله يعافيه,1
263,اشوف خويي ينضرب,0
264,الاسف تفاءلت لكثره اعلاناتكم الاعلانات شيء والواقع شيء اخر مكتوب ان التذكره مسترده ويوم جيت الغي الحجز الموظف يقولي لايمكن الغاء الذهاب الغاء العوده علما بان موعد الرحله يومين ورسوم الالغاء لكامل الرحله يعني تقريبا قيمه الحجز,0
265,مهيا شوال سكر الله يخزيهم يا الله,0
266,زين الجالكسي,0
267,شا مخي مستشفا قريب,0
268,المحاضرات يوم لمده ال ايام بتبقي الساعه ونص اشوفك فيكوا يوم ياللي حاطيين الجدول,0
269,اتكلمي معايا بتقاها اكتر كدا سمحتي,0
270,ويش الحلم الكوميدي الاكشن الدراما السيره ذاتيه,0
271,قصيمي ومكرش,0
272,انيوو بنات عضوه جديده ممكن دعم اردها,0
273,اول ميد اللي بعدوو,0
274,رزقهم يجي معاهم,0
275,شف خصم الهلال ووسع صدرك باذن الله نحتفل بالدوري رقم وفي مباراه ال,0
276,زينه,0
277,مكان الطقه ازرق ينعالل,0
278,داءما مواضيعهم تافهه,0
279,وسع وسع وسع لبزاز البقره الحلوب سماح اجمل بقره تويتر الكل يعمل ريتويت للبقره عشان اخلي المعرص حسام جوزي يصورني اكتر,0
280,العطور,0
281,اتوقعك راسك بينفجر الحقد,0
282,شلون الله يرحمها وانت تقول انها هندوسيه مب مسلمه صحيح انك,2
283,وين الرجاجيل قبيلتي نشوفهم,0
