id,tweet,hs_label
2095,يهبط ملاك الكون ال سعود ليصححوا مواقفهم وسياساتهم الهوجاء سيدنا محمد السلام تغير جبروتها وكبرياءها اشقاءها وجيرانها حجر اساس بناء مملكه ال سعود صك بيع فلسطيين لليهود تدفع ملاليم لفلسطين ومليارات لامريكا والصهيونيه,2
2096,موب مستوعب الزحمه عشان يصورونه اللحجيات,0
2097,اول مره اجرب شوفان مويه الطعم مقبول بتاتا الحليب الخيار الافضل,0
2098,وش كنت,0
2099,يبي سحل رفع ضغطي,0
2100,بقه يا ضحا ربنا ياخدك,0
2101,القصيم غبار,0
2102,هوا قعد يسبسبني وانا كلمت العيال اني فزت اروح اتونس,0
2103,قاعده الي بيرسل صوره طيزه سوداء ومشعره بللللووووككك يامقزز نظفها حلقها حط كريمات عمه كلب سكس خنيث ديوث محنه طفلك,0
2104,قناه تافهه وبرنامج تافه وموضوع تافه خلصت المواضيع المهمه الي تفيدهم مثلا توظيف العاطلات وحقوقهن وجايبين موضوع ينقص اخلاق وقيم نساءنا لاشافوه الدول الثانيه وش بيقولون نساءنا  فشلتونا,0
2105,الله الوكيل,0
2106,داءما اساتذه الرياضيات متسلطين قطيعه زود ان الماده صعبه اخلاقهم صارت وجيههم الا الان اتذكر ابلتي بصف خامس نوال خضير سليطه لسان وسليطه يد ابله نوال صدفه قريت التغريده احب اقولك تدور الدنيا وربي بياخذ حق البنات مو بالدنيا بالاخره ان شاءالله,1
2107,تستعمل مكان كاسيو عشان تعتبر ماركه,0
2108,اقبل ان تعلن تغريداتي اذهب اعلن الخلاء ان اردت يا بول البعير,0
2109,يالله خير,0
2110,الله يغسلها بالمطر,0
2111,للحين جا خوفي يجي الصلاه ويصير يقابل ابويا وتخرب خطتي ويقعد يستجوبني ايش طالبه وايش وليش,0
2112,المصيبه راتب الجندي يعادل تقريبا راتب المعلم شغلهم الشاغل المعلم طيب التفتوا يا العساكر للاعبين الكوره الي يلعب كوره تسالي ويستلم بالشهر نص مليون ويقولون ادعم ناديك,5
2113,الله يستر ويحفظه انكم جد شعب مشفح مافيه احد بالجنادريه ماصوره ماتخافون الله انتم,1
2114,يقال رواتب مشروع المسجد النبوي الشريف رمضان الله الوكيل الله المشتكا,0
2115,وانا رفعت ايديني ادعيلك,0
2116,الدنيا فتن الله يثبتنا فشلتونا,0
2117,تتتتففففاااااااهههههه عيب الي قاعد يسير شويه براءه طفله تقلبوها وشويه وحده منقبه ودحين دا شفيكممممم,0
2118,تفتكري,0
2119,لعنبو داركم تستحون الولد استحا وانتم مافي حياء ابد تراكم اناث والانثا اجمل مافيها الحياء  خقيتي عجبك روحي اشتري كليجا واطفحي لين تموتين مو تصوير وقرف كليتو الرجال عيب عيب انتي والله عيب قيمه المراه حياءها فقدت حياءها قيمه,1
2120,قدام اطرافه كبيره ورا يشبهه بلس,0
2121,توثيق ان الصور واللي يسرقون صوري حاب اقول طيزي الكبيره يا شيون توسيع خنيث اج,0
2122,الا اندونيسيات عقد اشهر الله الوكيل ثلاثه اشهر بعشره ليه,0
2123,نرش شوويه مييه بقي كدا علشان ربنا يكرمنا,0
2124,اخلاقنا بقياده السياره الكل يحترم الثاني ويفسح الطريق,0
2125,الرجال متلثم ريحه الحريم طلعت,1
2126,وحياتك,0
2127,ويزعلون انقال نويقصات,1
2128,شو هالعنصريه,0
2129,ككك ميونغ وانغ سونغ اسم السونبي اللي ميسوك كنت حاسه مطلقه ماتكلمت احس ماقدرت ااكد دا الشس المره دي قالتها,0
2130,جد وقاااحه صراحه,0
2131,مراسل استمرار تساقط القذاءف ضاحيه الاسد ومحيطها بريف دمشق وين الهدنه ولاد الحرام طز مجلس الامن,1
2132,الصخونه لاعبه فيني لاعب,0
2133,,0
2134,يقلع عدوش,0
2135,الحمدالله عافانا شي مخزي ومحزن التفاهه وصلت درجه نسيت وحده انها مسلمه,1
2136,البنات ﺇﺫﺍ ﺗﺰﻳﻨﺖ ﻓﺘﻨﺖ ﺇﺫﺍ اﺑﺘﺴﻤﺖ ﺳﺤﺮﺕ ﺑﺲ ﺇﺫﺍ ﻃﺒﺨﺖ  ﺇنا لله ﻭ ﺇﻧﺎ اﻟﻴﻪ راجعون الكلام,0
2137,هلق الشلي يرضي لله ذنوب يتساءل مراقبون,0
2138,منظر مقرف صدق,0
2139,هههههههههههههههههههههههههههههههه,0
2140,وع وش اللحيه عدل ابرك,0
2141,يافضحي فضحاه الله يفشلكم بنات فشلتونا ماتستحون  انا ابي اعرف ماينغزك قلبك ماعندك ضمير يقول يابهيمه عيب بموت مكاني الخجل وانا مالي دخل يويلي ماعد حيا,1
2142,الرجال يلبس كمام,0
2143,وانا اشهد مو حاطه وحده الا حاطه,0
2144,واحد يسال صاحبه تمارس هوايات خطره جدا قال احيانا ارد زوجتي معصبه,0
2145,شفت العنوان فكرته سار شي كبير العنوان اكبر الحدث,0
2146,ماشافت همجيه وملحجه بنات الرياض اوڤررر معليششش,1
2147,راا موسا السلام فتاه مدين لينفق عشر سنين عمره مهرا تستحق نقف الجواب قوله تعالا تمشي ا استحياء مات الحياء بقلب انثا فتبا,0
2148,بنات اثقلوا عيييب والله,0
2149,دي حاجه بسيطه كده يعني,0
2150,عيب الكعبه عيب وخير طير وحلو مايسوا افشل اهلي وانزل مستوا تربيتهم عشان اخق واحد انا اكبر والله صراحه البنات صارو يمحنو العلن مرض ان شاء الله الي يغبن زياده انه ترند,1
2151,ايه,0
2152,والله عدنا خير يصلحون داخل المطعم ندري وش يسوون وماندري اصلا لحم او,0
2153,تررررند اوڤر قسم بالله,0
2154,حد يعرف البنتين الورايا فالمحاضره يقولهم يبطلوا رغي علشان روشوا دماغ امي ودخلوا موضيع غريبه اوي,0
2155,مش تغريداتي تمثل حالتي يا ماما يكون عاجبني واكتبه  الاختفاء نومتي صايره عكس الناس مافيني العافيه,0
2156,الحنين بعدو زعلان ومش راضي تطلعي امبارح حلفلي بعيونك الحلوين انك لعندي رح ترجعي الاغنيه دي خيااااال الخير,0
2157,والله الكارثه تواجدك الساحه الرياضيه حق مشروع الانديه المشاركه بطوله الملك تتطور رياضتنا بتواجد امثالك,0
2158,انا راضي يوقفون القرض واحد والله,0
2159,اعوذ بالله,0
2160,النوع نموذج البيع نوع الحلال صلاليه برصا العدد العمر ٣ سنوات المالك بو,0
2161,هههههههههه الخرفان اللي يقهرون انا يلاحقون واحد يبيع مشهور ويصورنه ويجتمعون وماشاء الله تبارك الله الخالق قدامه يقولون حايمه كبده,0
2162,الله يسود وجهك وين اودي وجي,0
2163,الله يحوم كبدكم وياخذه تعدوا الرخص,0
2164,تصنيف الخرفان عادل الكلباني انا ولافخر الصنف الثالث,0
2165,واو صبح واضح بدايته,0
2166,يبيله ويمكن يطلع,0
2167,اعلام فاشل,5
2168,استغفر ربك,0
2169,ليش تبغها تتغزل ببنت مثلا انتم عادي تتغزلون بالبنات اذا حرام حرام,0
2170,اكيداكيد,0
2171,لانتس خاروفه ياخي,0
2172,الناس اللي بتدخل حياتنا تشيلنا ذنوب وتمشي زعلانه ياريت منشوفش وشوش اهلكوا تاني حياتنا,0
2173,اعوذبالله,0
2174,فشلتونا,0
2175,ميزه المراه طول تسامح عيبها دقيقتين تذكرك سامحتك,0
2176,الشر,0
2177,وقسسم,0
2178,الله يلعنك,0
2179,الله يستر يجي يوم اشوف زوجي ترند والله اموووووت,0
2180,ماتتخمدي,0
2181,شوف يحاربني فضحت الحسابات الاستخباراتيه تنشر العنصريه والفتنه بلادنا معرف اخونجي ارهابي جماعه تنظيم القاعده فرع النصره ينتحل اسم مراه سعوديه الخلااا يا كلب سجل يا طراد,3
2182,انا مالي دخل الرجل وسامته البنات اللي انا دخل كميه الاستشراف اللي التاق بيدخلون القبر بيتحاسبون  المشكله اوسخ حلال حرام انشغلوا انفسكم الله يشغلكم الناس,0
2183,اءمن الاخطاء تنقص الود تبني الحواجز,0
2184,صعبه قوويه,0
2185,استغفرالله,0
2186,انفولو,1
2187,يمه الحمدلله مداومت وش الاستهتار,0
2188,جايه الاحمدي,0
2189,واحد دلوع ابوه يشتغل مسلخ سالوه وش يشتغل ابوك  قال يقشر الغنم ابو تعال احد ناسيه,0
2190,ايه يجلده رحمه,0
2191,واضح البوينت اللقاء يا منصور ترا اشقانا درينا راعي الكليجا امتحنتوا اهلنا والموضوع جد اوڤر اكبر حجمه,0
2192,تعالين قبظنه شوفنه مخااازي,0
2193,مافي,0
2194,ناس مريض ربنا يشفي,0
2195,شكلتس شفتي عيالنا يوم يخقون الهنديه فشلونا الله يفشلهم,0
2196,مسخره تفاهه ثقاله اللجنه المتسابقين شي يطرب شو جاب اليسا واحلام حماقي لصابر كاظم العما كرهتونا الفن البرنامج,0
2197,اقطعي العلاقه يلي ماحسبتك تاكلي الشي,0
2198,المحاضره بقالها عشر سنين ولسه مخلصتش,0
2199,ياي وش دخل القوه الحين يا قوي,0
2200,فصل عاطفي جميل وجدير بهالعمل الراءع  خيب  وﻻ احبط  ونجح التغطيه الفكره اللي رفضتها بالعاطفه حبيت العمل  بيبقا الذاكره انتهاءه رح افقده  سعيد بنهايته باقي فصلين  نحكم كليا النهايه,0
2201,بقلب شيميل خلااااص,0
2202,تحديدا المدرب الله النصر ماحد درا ولان ينجح ابد لنصر لعدم وجود اللعبين المميزين الي كانو ينجحونه موسم استثناي تكاتف الجمهور وحماس اللعبين شويه الهياط,0
2203,مممممم توصا حريص,0
2204,لاتنسون انكم خرفان ايفانكا رءا الصبان,0
2205,براطمه خلاص راحت قصفك تم قصف ذباب دحلان,0
2206,ياشينه,0
2207,كلمات مترجمه ريش فيذر فرو فر جلد ليذر بشره سكن صوف,0
2208,انا مادري وشلون نبي نفلح وحنا شي ندخل الغناء مادري ليه الموسيقا والاختلاط تعتبر حقوق الجميع المسلوبه  حما الله بلادنا فكر السفهاء وهاجسه الوحيد اختلاص غناء,0
2209,شينو متحطم طلابه الله يالجيل المدلع الي مو مالي ارهب,0
2210,قوه الا بالله خافوا الله ياخي الولد يبي يترزق وانتوا تسمعونه كلام غزل ومدرس ايش استحوا شوي,0
2211,الحمد لله عافنا ابتلاه قسم بالله قله ادب ومافيه حيا للبنت راحت الهيبه خلاص الشرهه والله اهاليكن يالمسترجلات,1
2212,قومي ذاكري,0
2213,يطبخ النار طبعا البخار جدااا حااار يد طفل ترمس المويه الي لونه احمر والكاسات الحديد لونا فضي مسكه الكاس كانوا يغصبوني يصبون كاس واشربه غصصصب الين استفرغ اقسم بعزه جلال الله وبعدمااستفرغ يرجعون يكملون لين استفرغ مره ثانيه يضحكون,0
2214,الدنيا غبره ودوم ماحبت الزين تفرش حضنها فراش لليحچي وجهين الخزرجي,0
2215,يلعن ام الرخص,0
2216,ههههههههههه نتسهوك انا ماعرفتهمش شنو اصلا,0
2217,نار رحاب ولاجنه اولا,0
2218,هههههههه كيوت الجزيره ده,0
2219,اساسا حاطط المنشن غلط,0
2220,وشذا النشبه فتح البيك فرع الخرج حالنا اوامر وتسلط تراه بروستد لايغرك,0
2221,انا موبيلا ده بيتكلم قالا مالها امك حاطه نقرها نقرا ليه,0
2222,اص عشانا قلنا مزيون خليتونا كفار قريش يستشرف الكباءر ختمها القحاب فالمراقص وينيكهم ويقول لاااااا حرام هذولا محتاااجات وحنا قلنا راينا الزبده زق وخل نكحل يالاشهب ابي كليجا اليوم شكلي بروح بناااااااات تسكر الجنادريه,2
2223,احب ذا الجمال,0
2224,حزب الاصلاح الاخونجي الشمالي خاطف شرعيه عبدربه منصور يقول الامارات شبوه وعدن وحضرموت احتلال وانها تدعم مليشيات تقول الامارات تحالف تصد صواريخ الحوثي مارب الاخونج اذا تنفعه شوهه بسمعتك الامارات يا عبيد قطراءيل,3
2225,نزال طرف واحد شون مايكلز اسطوري الهزيمه ونتهت محد يفوز مو برون سترومان يقلب شاحنات دقايق متثبت وخسران,0
2226,عرفتي منين انه الشخص الغلط اصلي متمسكه بيه,0
2227,يطالبون بالغاء حد الرده نشر الشاءعات لتشويه وتمييع المجتمع النقاش القضايا تمس بالدين ودستور الحكم شي عادي بالواقع مايقوم مثير للشفقه,0
2228,تطريش,0
2229,بوعلي للاسف العدل يسار مجموعتي الاولا طبقين رءيسين وسلطه والمجموعه الثانيه يخفف ربي لايجعل سلطه علي,0
2230,الحين انتم يوم تشوفون حسابي تحسون بالجوع وتطري الكليجه والكبسه حاله خاصه,0
2231,ياساتر كس وجهه,0
2232,شيوخك ربع جمال ورزه واخلاق محمد سلمان وه مو زي اميركم المصنق تعرف مصنق يعني مقرف,0
2233,تعبت ثقل الحياه,0
2234,شوفي ماسكته وتمشيه وانا امس تسحب دم وابكي بقا شوي وتصفقني جلست تهدني الحيوانه,0
2235,دوب,0
2236,انا احيانا اشك انهم يتابعوني اني ماسكتهم واحد واحد اللي بيضيق خلقي يتابعني الحساب اللي تابعوني جننوني المرا اخذت قسم,0
2237,م اسوا تضطر تيلس ويا شخص يغني وتتحمل صوته السيء جدا جدا,0
2238,كفو اجلد الشيون الكروش مايعرفون الله الا  حليمه وايفانكا والمغربيات مافي شيء اسمه حرام تف الحضيره,1
2239,اي والله قلت الحق والخير مقبل,0
2240,انقاذ حسين عبدالغني للنصر هدف محقق الدقيقه ٥٣ اعتراضه تمريره هدف محقق السومه صوره لابوطفايه شكك القاءد,0
2241,تذكرت المجوسي الاكبرالكافر خامءني عمره حجه ولد الا يومه العاهر وينتقدون فريضه الحج فتواهم دفع الخمس اهم الحج ياعيال شريفه الحمدين دونكيين,1
2242,البكاء احيانا يكون العلاج الوحيد للفضفضه,0
2243,البنات اللي خاقات بايع الكليجه وضعكم وضع الشباب اللي كانوا خاقين بنت ترامب وع شوهتوا صورتنا قدام العالم,1
2244,اصيح علشان وحده رخيصه,0
2245,انور وربي متتت ضحكك شالسخافه تكفااا,0
2246,يشتهر الا التافهين للاسف,0
2247,الايجابي اننا متابعينك وتعرفنا يكفي اجمل باذن الله,0
2248,فكره ترو جوالي يفتح ببصمه وجهي,0
2249,كاشخ بالتقويم وريحته تعج بعدين وش هالشفشفه اللي,0
2250,استخبارات مو بنات,0
2251,اييييييييييييييييييييي مسكين وجك,0
2252,ايوه,0
2253,احم احم,0
2254,ادور الهواش سبب,0
2255,يع الاجانب بدو يسوون اللي امس طلعو يقولون حنا اول مره نسمع لاكسو عشان الفولو,0
2256,بسم الله الرحمن الرحيم  الله لايشغلنا الا بطاعته ٠,0
2257,حدك عااد عاشرتناا,0
2258,اسستغفرالله,0
2259,ماشاء الله انا كنت الثانوي اطلع الساعه ٢,0
2260,اوكي احب الكنافه واضح انها حرقان,0
2261,شفتي يا سنجاريه اشلون باعتك وربي الراصليه حقت ذبح مالك امان طيب عطينا البرنامج,0
2262,صاحب شركه الدعايه اسكندراني,0
2263,هههههههه مامنك فوووود والله هااااك,0
2264,مستحيل ينوكل كوارع صعبه,0
2265,واحد تزوج والثاني شرو مزرعه تمير,0
2266,البرد والانفلونزا,0
2267,حيييييييييييييييوان قرا تغريدتي لبجاد قرا الاسم والتغريده اللي قرا اسمها,0
2268,طفشش,0
2269,اوك الله جميل يحب الجمال يوصل تسوون هذا  استحوا وجيهكم يامال التبن  مره اوڤر اللي قاعد يصير فضحتونا العربان الله يفضح العدو  فشلتونا تقل شفتوا خير بلا شكلكم,1
2270,شلون ماااابي ارد الديره,0
2271,ههههههههههه جد واللي ناس يتخرفنون,0
2272,اغلب الناس ممكن يستغربون ليش الله ذكر نعيم للمراءه الجنه برجل القران لان الله عزوجل يبي يربينا ان المراءه يجب ان يكون حياءها موجود بالك الحين بدل نكون نستحي الرجال صرنا احنا الللي نتحرش مستحيل بنت ذره حياء تتقبل الموضوع,0
2273,مداوم السبت بالقنفذه ١٢ ٨ص ٨ مريض اسافر لمكه لاجل العمليه وفي النهايه يقولون ماعندك موعد,0
2274,قالج انقرضت انتي اخر دينصوره باقيه ويه الكره الارضيه,0
2275,طيب خلاص مو لازم تاق وترند علشان تبين انك خفيفه,0
2276,ازيك عامله ايه كويسه الحمد لله وانت كويس الحمد لله ايش والله المعني,0
2277,اذا قرود اسياء عطهم هالفيس واذا خدم شرهه اصلن يكفي ان الا دوري نقاط,3
2278,خرووووفااااات,0
2279,شيء اجمل من ان تكوني بطله نفسك تمضي في هذه الحياه امراه شجاعه تعرف ما تريد تعرف كيف تحصل عليه,0
2280,لاحول قوه بالله معاد حياء نعنبوكم,0
2281,ارحمو الابرياء ارحمو الاطفال ارحمو الفقرا ارحمو الناس تكفون تعبنا حنا اهل حضرموت مانحب المشاكل وين الصمرقع حقك ياخي تكفو اعلنو الانفصال خلاص تعبنا فقر وتعب استغفر الله الشمال نص او اكثر يبغو الانفصال وفك الارتباط الناس تعبت تبغا حرام الناس تموت جوع جوع,0
2282,سءال اصحاب العقول احنا دوله فقيره تخيلو شوي يعني شنو بتسووون بالشعب احنا اليوم اغنا الدول بالعالم بوق ومافي خطه ومافي احترام اصحاب الفكر المتميزين المجالات الاهتمام بالمواطن تنتظرون الهجره الحل تعبنا يا,0
2283,مساءكم انا تومبويز ديوث ليدي,0
2284,بنات طايحين واحد يبيع كليجا,0
2285,طايح محسن,0
2286,يظنون شده تحملنا نشعر,0
2287,تحقر الابله يجيك بداهيه,0
2288,خلوهم يتعددون والله فكه اجل تبينه بوجهه النكد فوجهك ٢٤ ساعه,0
2289,المطر جاني برد ذا مو مهم  الاحساس بالغبنه الكابه يوم ثاني شفت الشمس ذا الا لازمني,0
2290,متالفوش كلام الناس اتكلموا تعرفوه بدل مانتوا قاعدين تشتموا اتعاملوا معاه الاول كدا اتكلموا,0
2291,اصعب شي بهالدنيا طعنه تجيك حبيب اوصديق,0
2292,اكرهه ايش البنات قليلات الادب,1
2293,المشهد صورتوش لاني نسوق نعرفش لوقتاش الاستهانه بحياه الناس,0
2294,مدري انا صراحه مابعد بديت بدريكنقارد اللي عرفته اللي جربوا السلسله  نير الاول والثاني اكثر نهايه,0
2295,سكين حاده,0
2296,تعاملت تاجره الانستا تاريخ ٢٣ لين اليوم المحادثه مستمره وبعدني قلت وش الي اريده  يوم ترد مسج وتختفي سخافه وغباء,0
2297,للتذكير خوش منطق ورد الضيف,0
2298,تسلل لايكون احنا نتابع الكوره عشان جمال اللاعبين وانا مدري,0
2299,اسكت ده انا هستناك نااار يسطااا,0
2300,مسوي اني صريح واقول الي بخاطري حبيبي اذا عقليتك ومفهوم للرياضه روح بيتكم تطلع بالبرامج وتسوي بطل وصريح الباطن فريق اشتغل وتعب يستاهل يوصل وين المشكله شكل دق الخشوم الدحه اثرت نفسيه الغيامه الصياح يطلع بحرقه النصر,0
2301,قرود,0
2302,يقولون اني طيبه يعني عارفه انها حيه يعععع اكرهم العينات وياكثرهم حياتي,0
2303,اكثر المقاطع الي تستفزني اذا تميلحوا ومثلوا كلمات الاغنيه كانوا بنات او شباب,0
2304,يعنا انتوا متاكدين مش تركيب دا,0
2305,يارب يموت الدوام,0
2306,قلبي بقول انتي تبع ناس قفه فرح,0
2307,ابو نفسيته السويلم عزززز عال العال والله اعلم السبب,0
2308,محنه وملل الوقت,0
2309,يزن راسها بغلطها,0
2310,الكتمان زي النزيف الداخلي مفيش حد بيشوفه وجعه بيفضل جواك وبيموتك بالبطء,0
2311,اغار ايش عشانها تزوجت امريكي قال اني اتمنا امريكي وبموت اتزوجهم وش ابي بالخبلان اتشرف بالامريكان يشرفوني اتزوج,1
2312,حشرتني,0
2313,يوم كامل وانا جالس اتصل خدمه العملاء كالعاده محد يرد,0
2314,للاسف اشكالهم صايره كانهم كرتون,0
2315,ابوو التعبير المعووق والله نحبكم زي ماتحبونااا انتبهي لكلمه زي اتكلم سعودي,0
2316,اسكت انت وياه فشلتونا,0
2317,يتحمل المسءوليه سمح لوفد بشار المجرم بالحديث التبطح نيويورك الانخراط مجلس الامم وقاحه بوتين الدميه بشار قوانين الامم المتحده,0
2318,وع اوڤر اللي قاعد يصير حلالاه شب,0
2319,وش هالتخلف,0
2320,يع مدري ليش احسهم درر الي خاقات,0
2321,الرياض,0
2322,ههههههههههههههههههههههههههههههههههههههههههههههههههههههههههههههههههههههههه,0
2323,ابد ماهو الخاص عللللق,0
2324,يحاول يكون صاحب القرار الاسف وجدوا اشخاص شخصياتهم ضعيفه اللي عطاهم القوه بتخاذ القرار الاجباري واي شخص يعارضهم يصير مصيره مصير العواد ويوم البرايم اثبتوا للي يعارضهم الكلام نقضهم الاتفاق ان اللي يطلع اقل رصيد رساله مبطنه للي يعارضهم بالراي,0
